<?xml version="1.0" encoding="UTF-8"?>
<!--
  Operation catalogue, version 2 (operations.xsd). Every attribute is set deliberately; see SCHEDULING.spec.md §3
  and §10.2 for the meaning of each one.

  Time model: the client's `timeline` functions were `K * scale` (per-unit: active 0, per-unit K), `K * sqrt(scale)`
  (sub-linear: active 0, per-unit K) or a constant (fixed). With units = 1 every operation takes the same time as
  before. Passive parts come from the task's options (passive-from) or a constant.
-->
<operations xmlns:xsi="http://www.w3.org/2001/XMLSchema-instance" xsi:noNamespaceSchemaLocation="operations.xsd">

    <!-- ===== Preparation ===== -->

    <!-- Generated by the scheduler for mise en place: fetch the listed ingredients from the pantry, fridge or freezer.
         Per-unit = per ingredient. Never written in recipes. -->
    <operation name="gather" min-inputs="0" min-outputs="0" max-outputs="0"
               attention="attended" divisible="none" preemptible="anywhere" resume-cost="10"
               soil="none" station="counter" tedium="0.8">
        <title>Gather ingredients</title>
        <timeline model="per-unit" active="30" per-unit="8" passive="0"/>
    </operation>

    <operation name="measure" min-inputs="1" max-inputs="2" min-outputs="1" max-outputs="1"
               attention="attended" divisible="none" preemptible="never" soil="rinse" station="counter" tedium="1.2">
        <title>Measure</title>
        <options>
            <option name="amount" type="numeric" required="true"/>
        </options>
        <!-- seconds by the kind of amount: a spoon of spice, picking pieces, weighing on a scale, pouring a liquid;
             per-unit for anything else -->
        <timeline model="sub-linear" active="0" per-unit="45" spoon="20" count="15" weigh="40" pour="30" passive="0"/>
    </operation>

    <operation name="crumble" min-inputs="1" max-inputs="1" min-outputs="1"
               attention="attended" divisible="none" preemptible="never" soil="rinse" station="counter" tedium="1">
        <title>Crumble</title>
        <timeline model="per-unit" active="20" per-unit="5" passive="0"/>
    </operation>

    <operation name="separate" min-inputs="1" max-inputs="1" min-outputs="1"
               attention="attended" divisible="none" preemptible="anywhere" resume-cost="20" soil="wash" station="counter" tedium="1">
        <title>Separate</title>
        <timeline model="per-unit" active="60" per-unit="15" passive="0"/>
    </operation>

    <operation name="grate" min-inputs="1" max-inputs="1" min-outputs="1"
               attention="attended" divisible="none" preemptible="anywhere" resume-cost="20" soil="rinse" station="counter" tedium="1.3">
        <title>Grate</title>
        <timeline model="per-unit" active="0" per-unit="120" passive="0"/>
    </operation>

    <operation name="slice" min-inputs="1" max-inputs="1" min-outputs="1"
               attention="attended" divisible="none" preemptible="never" soil="rinse" station="counter" tedium="1" requires="knife">
        <title>Slice</title>
        <options>
            <option name="parts" type="numeric" required="true"/>
        </options>
        <timeline model="sub-linear" active="0" per-unit="60" passive="0"/>
    </operation>

    <operation name="peel" min-inputs="1" max-inputs="1" min-outputs="1"
               attention="attended" divisible="units" min-chunk="180" preemptible="units" soil="rinse" station="counter" tedium="1" requires="knife">
        <title>Peel</title>
        <timeline model="per-unit" active="0" per-unit="60" passive="0"/>
    </operation>

    <operation name="split" min-inputs="1" max-inputs="1" min-outputs="1"
               attention="attended" divisible="units" min-chunk="180" preemptible="units" soil="rinse" station="counter" tedium="1" expand="split">
        <title>Split</title>
        <options>
            <option name="parts" type="numeric" required="false"/>
            <option name="unit-size" type="numeric" required="false" default-unit="grams"/>
        </options>
        <timeline model="per-unit" active="30" per-unit="3" passive="0"/>
    </operation>

    <!-- Knife work and other preparation added for recipes imported from the web. Per-unit = per recipe batch of the
         ingredient (units = the scale) or per stream unit, so two people can share a big pile of chopping. -->
    <operation name="chop" min-inputs="1" max-inputs="1" min-outputs="1"
               attention="attended" divisible="units" min-chunk="180" preemptible="units" soil="rinse" station="counter" tedium="1.1" requires="knife">
        <title>Chop</title>
        <timeline model="per-unit" active="20" per-unit="90" passive="0"/>
    </operation>

    <operation name="dice" min-inputs="1" max-inputs="1" min-outputs="1"
               attention="attended" divisible="units" min-chunk="180" preemptible="units" soil="rinse" station="counter" tedium="1.2" requires="knife">
        <title>Dice</title>
        <timeline model="per-unit" active="20" per-unit="150" passive="0"/>
    </operation>

    <operation name="mince" min-inputs="1" max-inputs="1" min-outputs="1"
               attention="attended" divisible="units" min-chunk="180" preemptible="units" soil="rinse" station="counter" tedium="1.2" requires="knife">
        <title>Mince</title>
        <timeline model="per-unit" active="20" per-unit="120" passive="0"/>
    </operation>

    <!-- Cut something into pieces or portions: bars, a tray bake, a pizza, chicken into strips. -->
    <operation name="cut" min-inputs="1" max-inputs="1" min-outputs="1"
               attention="attended" divisible="units" min-chunk="180" preemptible="units" soil="rinse" station="counter" tedium="1" requires="knife">
        <title>Cut</title>
        <options>
            <option name="parts" type="numeric" required="false"/>
        </options>
        <timeline model="per-unit" active="30" per-unit="8" passive="0"/>
    </operation>

    <operation name="zest" min-inputs="1" max-inputs="1" min-outputs="1"
               attention="attended" divisible="units" min-chunk="180" preemptible="units" soil="rinse" station="counter" tedium="1.1">
        <title>Zest</title>
        <timeline model="per-unit" active="10" per-unit="60" passive="0"/>
    </operation>

    <operation name="juice" min-inputs="1" max-inputs="1" min-outputs="1"
               attention="attended" divisible="units" min-chunk="180" preemptible="units" soil="rinse" station="counter" tedium="1">
        <title>Juice</title>
        <timeline model="per-unit" active="10" per-unit="40" passive="0"/>
    </operation>

    <operation name="crush" min-inputs="1" max-inputs="1" min-outputs="1"
               attention="attended" divisible="none" preemptible="anywhere" resume-cost="20" soil="rinse" station="counter" tedium="1">
        <title>Crush</title>
        <timeline model="sub-linear" active="30" per-unit="90" passive="0"/>
    </operation>

    <operation name="sift" min-inputs="1" min-outputs="1"
               attention="attended" divisible="none" preemptible="never" soil="rinse" station="counter" tedium="1">
        <title>Sift</title>
        <timeline model="sub-linear" active="0" per-unit="45" passive="0"/>
    </operation>

    <operation name="rinse" min-inputs="1" max-inputs="1" min-outputs="1"
               attention="attended" divisible="none" preemptible="never" soil="none" station="sink" tedium="1">
        <title>Rinse</title>
        <timeline model="per-unit" active="20" per-unit="30" passive="0"/>
    </operation>

    <!-- Pour off the cooking liquid (pasta, potatoes, beans) or let something drip dry in a colander. -->
    <operation name="drain" min-inputs="1" max-inputs="1" min-outputs="1"
               attention="attended" divisible="none" preemptible="never" soil="rinse" station="sink" tedium="1">
        <title>Drain</title>
        <timeline model="fixed" active="60" passive="0"/>
    </operation>

    <operation name="season" min-inputs="2" min-outputs="1"
               attention="attended" divisible="none" preemptible="never" soil="none" station="counter" tedium="1">
        <title>Season</title>
        <timeline model="sub-linear" active="10" per-unit="20" passive="0"/>
    </operation>

    <!-- ===== Mixing ===== -->

    <operation name="mix" min-inputs="1" min-outputs="1"
               attention="attended" divisible="none" preemptible="anywhere" resume-cost="20" soil="wash" station="counter" tedium="1">
        <title>Mix</title>
        <timeline model="sub-linear" active="0" per-unit="60" passive="0"/>
    </operation>

    <operation name="incorporate" min-inputs="2" min-outputs="1"
               attention="attended" divisible="none" preemptible="anywhere" resume-cost="20" soil="wash" station="counter" tedium="1">
        <title>Mix</title>
        <timeline model="per-unit" active="0" per-unit="60" passive="0"/>
    </operation>

    <operation name="mix-in-steps" min-inputs="2" min-outputs="1"
               attention="attended" divisible="none" preemptible="never" soil="wash" station="counter" tedium="1">
        <title>Mix in steps</title>
        <options>
            <option name="task-size" type="numeric" required="false" default-unit="deciliters"/>
        </options>
        <timeline model="per-unit" active="0" per-unit="10" passive="0"/>
    </operation>

    <operation name="beat" min-inputs="1" max-inputs="1" min-outputs="1"
               attention="attended" divisible="none" preemptible="never" soil="wash" station="counter" tedium="1">
        <title>Beat</title>
        <timeline model="per-unit" active="0" per-unit="60" passive="0"/>
    </operation>

    <operation name="whip" min-inputs="1" max-inputs="1" min-outputs="1"
               attention="attended" divisible="none" preemptible="anywhere" resume-cost="20" soil="wash" station="counter" tedium="1">
        <title>Whip</title>